{
  "urn": "urn:odgs:def:fibo:loan:v2024",
  "metadata": {
    "authority_id": "FIBO",
    "authority_name": "Financial Industry Business Ontology",
    "document_ref": "FIBO Master",
    "source_uri": "https://spec.edmcouncil.org/fibo/ontology/LOAN/LoansGeneral/Loans/Loan",
    "module": "LOAN/LoansGeneral/Loans",
    "hierarchy": {
      "level": "concept",
      "local_id": "Loan"
    },
    "content_hash": "1fdcbfabcdd1ecb9fcefd2fb41c7d2f1329399086d05ea64a36a54061554c94b",
    "harvested_at": "2026-02-24T20:24:35.525549Z"
  },
  "relations": [],
  "content": {
    "verbatim_text": "Concept: Loan (https://spec.edmcouncil.org/fibo/ontology/LOAN/LoansGeneral/Loans/Loan)",
    "language": "en-US",
    "format": "JSON_LD",
    "structured_data": {
      "@id": "https://spec.edmcouncil.org/fibo/ontology/LOAN/LoansGeneral/Loans/Loan",
      "http://www.w3.org/2000/01/rdf-schema#subClassOf": [
        {
          "@id": "https://spec.edmcouncil.org/fibo/ontology/FBC/DebtAndEquities/Debt/CreditAgreementRepaidPeriodically"
        },
        {
          "@id": "_:b25"
        },
        {
          "@id": "_:b35"
        },
        {
          "@id": "_:b8"
        },
        {
          "@id": "_:b36"
        },
        {
          "@id": "_:b1"
        },
        {
          "@id": "_:b26"
        },
        {
          "@id": "_:b37"
        },
        {
          "@id": "_:b21"
        },
        {
          "@id": "_:b38"
        },
        {
          "@id": "_:b39"
        },
        {
          "@id": "_:b40"
        },
        {
          "@id": "https://spec.edmcouncil.org/fibo/ontology/FBC/FinancialInstruments/FinancialInstruments/DebtInstrument"
        }
      ],
      "http://www.w3.org/2004/02/skos/core#definition": [
        {
          "@value": "debt instrument whereby one party extends money or credit to another party (or parties) with the understanding that the borrowed money will be repaid according to the terms of the contract"
        }
      ],
      "http://www.w3.org/2000/01/rdf-schema#isDefinedBy": [
        {
          "@id": "https://spec.edmcouncil.org/fibo/ontology/LOAN/LoansGeneral/Loans/"
        }
      ],
      "@type": [
        "http://www.w3.org/2002/07/owl#Class"
      ],
      "http://www.w3.org/2000/01/rdf-schema#label": [
        {
          "@value": "loan"
        }
      ]
    }
  },
  "interpretation": {
    "summary": "FIBO definition of Loan",
    "applicability": "Financial Sector"
  }
}