{
  "urn": "urn:odgs:def:eu:gdpr:art_6:v2016",
  "metadata": {
    "authority_id": "EU_GDPR",
    "authority_name": "EU General Data Protection Regulation (2016/679)",
    "document_ref": "GDPR Article 6",
    "source_uri": "https://eur-lex.europa.eu/legal-content/EN/TXT/?uri=CELEX:32016R0679#d1e1888-1-1",
    "hierarchy": {
      "level": "article",
      "chapter": "Chapter II — Principles",
      "local_id": "Art_6"
    },
    "content_hash": "eaedbcae889dc385774389a5177551df027515011a8499d273a945431e4446ff",
    "harvested_at": "2026-02-18T22:30:46.764615Z"
  },
  "relations": [],
  "content": {
    "verbatim_text": "Processing shall be lawful only if and to the extent that at least one of the following applies: (a) the data subject has given consent; (b) processing is necessary for the performance of a contract; (c) processing is necessary for compliance with a legal obligation; (d) processing is necessary to protect vital interests; (e) processing is necessary for a task carried out in the public interest; (f) processing is necessary for legitimate interests pursued by the controller.",
    "title": "Lawfulness of processing",
    "language": "en",
    "format": "TEXT",
    "structured_data": {
      "regulation": "GDPR (2016/679)",
      "article_number": 6,
      "chapter": "Chapter II — Principles",
      "relevance_to_odgs": "Legal basis for all data processing — prerequisite for any ODGS metric computation"
    }
  },
  "interpretation": {
    "summary": "GDPR Art. 6: Lawfulness of processing",
    "applicability": "All organizations processing personal data of EU residents"
  }
}