{
  "urn": "urn:odgs:def:eu:gdpr:art_25:v2016",
  "metadata": {
    "authority_id": "EU_GDPR",
    "authority_name": "EU General Data Protection Regulation (2016/679)",
    "document_ref": "GDPR Article 25",
    "source_uri": "https://eur-lex.europa.eu/legal-content/EN/TXT/?uri=CELEX:32016R0679#d1e3063-1-1",
    "hierarchy": {
      "level": "article",
      "chapter": "Chapter IV — Controller and Processor",
      "local_id": "Art_25"
    },
    "content_hash": "9a0c7bcc68ac22ebd4a1879af8300762419b7a61feefc2bfb83a7c39feab484c",
    "harvested_at": "2026-03-12T13:37:00.574336Z"
  },
  "relations": [],
  "content": {
    "verbatim_text": "The controller shall, both at the time of the determination of the means for processing and at the time of the processing itself, implement appropriate technical and organisational measures, such as pseudonymisation, which are designed to implement data-protection principles in an effective manner and to integrate the necessary safeguards into the processing.",
    "title": "Data protection by design and by default",
    "language": "en",
    "format": "TEXT",
    "structured_data": {
      "regulation": "GDPR (2016/679)",
      "article_number": 25,
      "chapter": "Chapter IV — Controller and Processor",
      "relevance_to_odgs": "Architecture-level governance — requires data quality controls to be embedded by design, not bolted on"
    }
  },
  "interpretation": {
    "summary": "GDPR Art. 25: Data protection by design and by default",
    "applicability": "All organizations processing personal data of EU residents"
  }
}