{
  "urn": "urn:odgs:def:nl_gov:awb:art_1_3:v2024",
  "metadata": {
    "authority_id": "NL_GOV",
    "authority_name": "Government of the Netherlands",
    "document_ref": "Algemene wet bestuursrecht (AwB)",
    "source_uri": "https://repository.officiele-overheidspublicaties.nl/bwb/BWBR0005537/2024-01-01_0/xml/BWBR0005537_2024-01-01_0.xml#art_1:3",
    "hierarchy": {
      "level": "article",
      "parent_ref": "AwB",
      "local_id": "1:3"
    },
    "content_hash": "e2d270715b7041b64d845b06eb63a8436d623e164472f5762c28a927dbb808e7",
    "harvested_at": "2026-03-12T13:37:01.490286Z"
  },
  "relations": [],
  "content": {
    "verbatim_text": "Lid 1: Onder besluit wordt verstaan: een schriftelijke beslissing van een bestuursorgaan, inhoudende een publiekrechtelijke rechtshandeling.\nLid 2: Onder beschikking wordt verstaan: een besluit dat niet van algemene strekking is, met inbegrip van de afwijzing van een aanvraag daarvan.\nLid 3: Onder aanvraag wordt verstaan: een verzoek van een belanghebbende, een besluit te nemen.\nLid 4: Onder beleidsregel wordt verstaan: een bij besluit vastgestelde algemene regel, niet zijnde een algemeen verbindend voorschrift, omtrent de afweging van belangen, de vaststelling van feiten of de uitleg van wettelijke voorschriften bij het gebruik van een bevoegdheid van een bestuursorgaan.",
    "language": "nl-NL",
    "format": "XML_FRAGMENT",
    "structured_data": {}
  },
  "interpretation": {
    "summary": "Auto-harvested definition — AwB Artikel 1:3.",
    "applicability": "General Administrative Law"
  }
}