{
  "urn": "urn:odgs:def:eu:gdpr:art_5:v2016",
  "metadata": {
    "authority_id": "EU_GDPR",
    "authority_name": "EU General Data Protection Regulation (2016/679)",
    "document_ref": "GDPR Article 5",
    "source_uri": "https://eur-lex.europa.eu/legal-content/EN/TXT/?uri=CELEX:32016R0679#d1e1807-1-1",
    "hierarchy": {
      "level": "article",
      "chapter": "Chapter II — Principles",
      "local_id": "Art_5"
    },
    "content_hash": "1d294f67f551d9d7dbbc072c25121bd617f0acf2b4e4122d07a01477b82e4be9",
    "harvested_at": "2026-02-24T20:24:28.762629Z"
  },
  "relations": [],
  "content": {
    "verbatim_text": "Personal data shall be: (a) processed lawfully, fairly and in a transparent manner in relation to the data subject ('lawfulness, fairness and transparency'); (b) collected for specified, explicit and legitimate purposes and not further processed in a manner that is incompatible with those purposes ('purpose limitation'); (c) adequate, relevant and limited to what is necessary in relation to the purposes for which they are processed ('data minimisation'); (d) accurate and, where necessary, kept up to date ('accuracy'); (e) kept in a form which permits identification of data subjects for no longer than is necessary ('storage limitation'); (f) processed in a manner that ensures appropriate security ('integrity and confidentiality').",
    "title": "Principles relating to processing of personal data",
    "language": "en",
    "format": "TEXT",
    "structured_data": {
      "regulation": "GDPR (2016/679)",
      "article_number": 5,
      "chapter": "Chapter II — Principles",
      "relevance_to_odgs": "Foundational data quality principles — maps directly to ODGS DQ dimensions (Accuracy, Completeness, Timeliness)"
    }
  },
  "interpretation": {
    "summary": "GDPR Art. 5: Principles relating to processing of personal data",
    "applicability": "All organizations processing personal data of EU residents"
  }
}