{
  "urn": "urn:odgs:def:eu:gdpr:art_30:v2016",
  "metadata": {
    "authority_id": "EU_GDPR",
    "authority_name": "EU General Data Protection Regulation (2016/679)",
    "document_ref": "GDPR Article 30",
    "source_uri": "https://eur-lex.europa.eu/legal-content/EN/TXT/?uri=CELEX:32016R0679#d1e3265-1-1",
    "hierarchy": {
      "level": "article",
      "chapter": "Chapter IV — Controller and Processor",
      "local_id": "Art_30"
    },
    "content_hash": "abab4239396644bd2288898f549848b3817a4f9bbafe73d891b438d8ebac47bf",
    "harvested_at": "2026-02-18T22:30:46.764937Z"
  },
  "relations": [],
  "content": {
    "verbatim_text": "Each controller and, where applicable, the controller's representative, shall maintain a record of processing activities under its responsibility. That record shall contain: (a) the name and contact details of the controller; (b) the purposes of the processing; (c) a description of the categories of data subjects and personal data; (d) the categories of recipients; (e) transfers to third countries; (f) time limits for erasure; (g) a description of technical and organisational security measures.",
    "title": "Records of processing activities",
    "language": "en",
    "format": "TEXT",
    "structured_data": {
      "regulation": "GDPR (2016/679)",
      "article_number": 30,
      "chapter": "Chapter IV — Controller and Processor",
      "relevance_to_odgs": "Data lineage and cataloguing — the regulatory mandate for ODGS process maps and audit trails"
    }
  },
  "interpretation": {
    "summary": "GDPR Art. 30: Records of processing activities",
    "applicability": "All organizations processing personal data of EU residents"
  }
}